{"run_id":"PPR-RUN-EXAMPLE-001","chapter_id":"CH-EXAMPLE","volume_id":"VOL-EXAMPLE","stage":"proof","baseline_id":"PPR-BL-EXAMPLE-001","proof_id":"proof-v1","output_formats":["pdf"],"approved_variations_id":"VAR-EXAMPLE","correction_channel":"authorized-grid","upstream_statuses":[{"skill_id":"CPR","run_id":"CPR-RUN-EXAMPLE","status":"pass","finding_ids":[],"owner":"CPR owner","severity":null,"release_effect":"none","refreshed_at":"2026-08-14T00:00:00Z","evidence_locator":"CPR-RUN-EXAMPLE"}],"protected_record_policy":"authorized channels only","signatory_role":"volume editor","reviewer":"PPR reviewer","started_at":"2026-08-14T00:00:00Z"}
